{
  "$schema": "https://json-schema.org/draft/2020-12/schema",
  "title": "消费调解协议履约领域资料",
  "type": "object",
  "required": [
    "domain",
    "version",
    "sample_id",
    "actors",
    "facts",
    "constraints",
    "records"
  ],
  "properties": {
    "domain": {
      "type": "string",
      "const": "consumer-settlement-fulfillment"
    },
    "version": {
      "type": "integer",
      "minimum": 1
    },
    "sample_id": {
      "type": "string",
      "minLength": 1
    },
    "actors": {
      "type": "array",
      "minItems": 2,
      "items": {
        "type": "string"
      }
    },
    "facts": {
      "type": "array",
      "minItems": 2,
      "items": {
        "type": "string"
      }
    },
    "constraints": {
      "type": "array",
      "minItems": 2,
      "items": {
        "type": "string"
      }
    },
    "records": {
      "type": "array",
      "minItems": 2,
      "items": {
        "type": "object",
        "required": [
          "id",
          "kind",
          "label",
          "status"
        ],
        "properties": {
          "id": {
            "type": "string",
            "minLength": 1
          },
          "kind": {
            "type": "string",
            "minLength": 1
          },
          "label": {
            "type": "string",
            "minLength": 1
          },
          "status": {
            "type": "string",
            "enum": [
              "active",
              "pending",
              "historical"
            ]
          }
        },
        "additionalProperties": false
      }
    }
  },
  "additionalProperties": false
}
